id	text	title
718	In 1845 it joined the United States as the 28th state.	Texas
719	Smirnoff is a brand of vodka owned and produced by the British company Diageo .	Smirnoff
720	The Matrix is a 1999 American–Australian science fiction action film written and directed by The Wachowski Brothers and starring Keanu Reeves , Laurence Fishburne , Carrie-Anne Moss , Joe Pantoliano , and Hugo Weaving .	The Matrix
721	"It uses a set of quality management methods, including statistical methods , and creates a special infrastructure of people within the organization (""Champions"", ""Black Belts"", ""Green Belts"", ""Orange Belts"", etc.) who are experts in these very complex methods."	Six sigma
722	The Serenity Prayer is the common name for an originally untitled prayer by the American theologian Reinhold Niebuhr (1892–1971).	Serenity Prayer
723	The Declaration and Resolves of the First Continental Congress (also known as the Declaration of Colonial Rights, or the Declaration of Rights), was a statement adopted by the First Continental Congress on October 14, 1774, in response to the Intolerable Acts passed by the British Parliament .	Declaration and Resolves of the First Continental Congress
724	The Declaration outlined colonial objections to the Intolerable Acts, listed a colonial bill of rights , and provided a detailed list of grievances.	Declaration and Resolves of the First Continental Congress
725	It was similar to the Declaration of Rights and Grievances , passed by the Stamp Act Congress a decade earlier.	Declaration and Resolves of the First Continental Congress
726	In poker , bad beat is a subjective term for a hand in which a player with what appear to be strong cards nevertheless loses.	Bad beat
727	The cut is usually topside beef or silverside since this is the cheaper cut.	Rouladen
728	Cellular respiration is the set of the metabolic reactions and processes that take place in the cells of organisms to convert biochemical energy from nutrients into adenosine triphosphate (ATP), and then release waste products.	Cellular respiration
729	The company was formed by a merger between Massey Harris and the Ferguson Company farm machinery manufacturer in 1953, creating the company Massey Harris Ferguson.	Massey Ferguson
730	Lapping is a machining process, in which two surfaces are rubbed together with an abrasive between them, by hand movement or by way of a machine.	Lapping
731	The show follows Ethan Morgan ( Matthew Knight ), who, in the television film, learns that his babysitter Sarah ( Vanessa Morgan ) is a vampire .	My Babysitter's a Vampire (TV series)
732	"Kanien'kehá:ka (""People of the Place of Flint"") are an Iroquoian -speaking indigenous people of North America originally from the Mohawk Valley in upstate New York ."	Mohawk people
733	Their current settlements include areas around Lake Ontario and the St Lawrence River in Canada .	Mohawk people
734	Their traditional homeland stretched southward of the Mohawk River , eastward to the Green Mountains of Vermont , westward to the border with the Oneida Nation 's traditional homeland territory, and northward to the St Lawrence River.	Mohawk people
735	DeShaun Dupree Holton (October 2, 1973 – April 11, 2006), better known by his stage name Proof, was an American rapper and actor from Detroit , Michigan .	Proof (rapper)
736	In 2006, Proof was shot and killed during an altercation at the CCC nightclub in Detroit.	Proof (rapper)
737	The seven SI base units and the interdependency of their definitions: for example, to extract the definition of the metre from the speed of light , the definition of the second must be known while the ampere and candela are both dependent on the definition of energy which in turn is defined in terms of length , mass and time .	SI base unit
738	World War I (WWI) was a global war centred in Europe that began on 28 July 1914 and lasted until 11 November 1918.	World War I
739	North American telephone area codes 419 and 567 serve the northwest quadrant of the U.S. state of Ohio .	Area codes 419 and 567
740	The September 11 attacks (also referred to as September 11, September 11th, or 9/11) were a series of four coordinated terrorist attacks launched by the Islamic terrorist group al-Qaeda upon the United States in New York City and the Washington, D.C. area on September 11, 2001.	September 11 attacks
741	Tax deposits are formally entrusted to the Federal Old-Age and Survivors Insurance Trust Fund, the Federal Disability Insurance Trust Fund, the Federal Hospital Insurance Trust Fund, or the Federal Supplementary Medical Insurance Trust Fund which comprise the Social Security Trust Fund .	Social Security (United States)
742	Laurel Hollow is a village in the Town of Oyster Bay in Nassau County, New York in the United States .	Laurel Hollow, New York
743	Charles John Huffam Dickens (; 7 February 1812 – 9 June 1870) was an English writer and social critic.	Charles dickens
744	The civil rights movement was a series of worldwide political movements for equality before the law that peaked in the 1960s.	Civil rights movement
745	In the final, Spain , the European champions , defeated third-time finalists the Netherlands 1–0 after extra time , with Andrés Iniesta 's goal in the 116th minute giving Spain their first world title, becoming the eighth nation to win the tournament, and the first European nation to win the tournament outside its home continent.	2010 FIFA World Cup
746	The Egg McMuffin is the signature breakfast sandwich; it was invented by the late McDonald's franchisee Herb Peterson in the late 1960s and was introduced nationwide in 1972.	McMuffin
747	He was shot by Mark David Chapman at the entrance of the building where he lived, The Dakota , in New York City on 8 December 1980.	Death of John Lennon
748	New Orleans ( or , locally or ; ) is a major United States port and the largest city and metropolitan area in the state of Louisiana .	New Orleans
749	It was a wrenching national experience, conducted during a year of violence that included the assassination of civil rights leader Martin Luther King, Jr. , and subsequent race riots across the nation, the assasination of Democratic presidential candidate Robert F. Kennedy , widespread opposition to the Vietnam War across university campuses, and violent confrontations between police and anti-war protesters at the 1968 Democratic National Convention as the Democratic party split again and again.	United States presidential election, 1968
750	On April 8, 1994, Cobain was found dead at his home in Seattle , the victim of what was officially ruled a suicide by a self-inflicted shotgun wound to the head.	Kurt Cobain
751	John Wayne stars as U.S. Marshal Rooster Cogburn and won his only Academy Award for his performance in this film.	True Grit (1969 film)
752	A millwright is a craftsman or tradesman engaged with the construction and maintenance of machinery .	Millwright
753	Destiny's Child was an American R&B girl group whose final, and perhaps most recognizable, line-up comprised Beyoncé Knowles , Kelly Rowland and Michelle Williams .	Destiny's Child
754	Developed around 1795 by the French-Swiss watchmaker Abraham-Louis Breguet from an earlier idea by the English chronometer maker John Arnold , a tourbillon aims to counter the effects of gravity by mounting the escapement and balance wheel in a rotating cage, to negate the effect of gravity when the timepiece (thus the escapement) is stuck in a certain position.	Tourbillon
755	The Windows Installer (previously known as Microsoft Installer) is a software component used for the installation, maintenance, and removal of software on modern Microsoft Windows systems.	Windows Installer
756	The Mexican War of Independence (1810–1821) was an armed conflict between the people of Mexico and the Spanish colonial authorities which started on September 16, 1810.	Mexican War of Independence
757	Procedure codes are numbers or alphanumeric codes used to identify specific health interventions taken by medical professionals.	Procedure codes
758	Four Loko is a line of alcoholic beverages , originally marketed as energy drinks , sold by Phusion Projects of Chicago, Illinois .	Four Loko
759	A fret is a raised element on the neck of a stringed instrument .	Fret
760	"An advertising campaign featuring Smokey was created in 1944 with the slogan, ""Smokey Says – Care Will Prevent 9 out of 10 Forest Fires""."	Smokey Bear
761	Newton Norman Minow (born January 17, 1926) is an American attorney and former Chairman of the Federal Communications Commission .	Newton N. Minow
762	"A duvet ( or ; ; from the French duvet ""down""), also known as a doona in Australian English or a continental quilt (or simply quilt) in British English , but this usage is no longer common, is a type of bedding , a soft flat bag filled with down , feathers , wool , silk or a synthetic alternative, and protected with a removable cover, analogous to a pillow and pillow case."	Duvet
763	Mr. Bojangles is the title of a song originally written and recorded by American country music artist Jerry Jeff Walker for his 1968 album of the same title.	Mr. Bojangles (song)
764	A talent agent, or booking agent, is a person who finds jobs for actors , authors , film directors , musicians , models , producers, professional athletes , writers and other people in various entertainment businesses.	Talent agent
765	An agent also defends, supports and promotes the interest of his/her clients.	Talent agent
766	Both satellites were discovered in 1877 by Asaph Hall and are named after the characters Phobos (panic/fear) and Deimos (terror/dread) who, in Greek mythology , accompanied their father Ares , god of war, into battle.	Moons of Mars
767	In law enforcement parlance, the term murder book refers to the case file of a murder investigation.	Murder book
768	She is a retired professor with the History of Consciousness Department at the University of California, Santa Cruz , and is the former director of the university's Feminist Studies department.	Angela Davis
769	Love Always is the debut album of American R&B duo K-Ci & JoJo , released on June 17, 1997, by MCA Records .	Love Always
770	West Side Story is an American musical with a book by Arthur Laurents , music by Leonard Bernstein , lyrics by Stephen Sondheim , and conception and choreography by Jerome Robbins .	West Side Story
771	Sirhan Sirhan , a 24-year-old Palestinian / Jordanian immigrant , was convicted of Kennedy's murder and is serving a life sentence for the crime.	Assassination of Robert F. Kennedy
772	"The film raises the question ""Can men and women ever just be friends?"" and advances many ideas about relationships that became household concepts, such as those of the """" girlfriend and the ""transitional person""."	When Harry Met Sally...
773	It is made by General Mills .	Hamburger Helper
774	A dwarf planet is a planetary-mass object that is neither a planet nor a satellite .	Dwarf planet
775	More explicitly, the International Astronomical Union (IAU) defines a dwarf planet as a celestial body in direct orbit of the Sun that is massive enough for its shape to be controlled by gravitation , but that unlike a planet has not cleared its orbital region of other objects.	Dwarf planet
776	"Francois Henri ""Jack"" LaLanne (September 26, 1914 - January 23, 2011) was an American fitness , exercise , and nutritional expert and motivational speaker who is sometimes called ""the godfather of fitness"" and the ""first fitness superhero."""	Jack LaLanne
777	The Care Bears are characters created by American Greetings in 1981 for use on greeting cards .	Care Bears
778	Interstate 70 (I-70) is an Interstate Highway in the United States that runs from Interstate 15 near Cove Fort, Utah , to a Park and Ride near Baltimore, Maryland .	Interstate 70
779	"As seen from the Earth , a solar eclipse occurs when the Moon passes between the Sun and Earth, and the Moon fully or partially blocks ("" occults "") the Sun."	Solar eclipse
780	The mango is native to South Asia , from where it has been distributed worldwide to become one of the most cultivated fruits in the tropics .	Mango
781	It currently (Year 2013) lies at 23° 26′ 15.143′′ north of the Equator.	Tropic of cancer
782	Discs using the DVD-Video specification require a DVD drive and an H.262/MPEG-2 Part 2 decoder (e.g., a DVD player, or a computer DVD drive with a software DVD player).	DVD-Video
783	The United States Postal Service (USPS), also known as the Post Office and U.S. Mail, is an independent agency of the United States federal government responsible for providing postal service in the United States.	United States Postal Service
784	Washington, D.C. has been the capital of the United States since 1800.	List of capitals in the United States
785	The face-up shape of the princess cut is square or rectangular and the profile or side-on shape is similar to that of an inverted pyramid with four beveled sides.	Princess cut
786	The Monte Carlo SS was revived from 2000 to 2007 and initially powered by 3.8-liter V6 (supercharged in 2004–2005), later to be replaced by a 5.3-liter V8 for 2006–2007.	Chevrolet Monte Carlo
787	Scottsdale ( O'odham Vaṣai S-vaṣonĭ; Yaqui Eskatel) is a city in the eastern part of Maricopa County, Arizona , United States , adjacent to Phoenix .	Scottsdale, Arizona
788	Following a high-profile relationship with actress Gwyneth Paltrow , Pitt was married to actress Jennifer Aniston for five years.	Brad Pitt
789	The domestic dog (Canis lupus familiaris) is a subspecies of the gray wolf (Canis lupus), a member of the Canidae family of the mammalian order Carnivora .	Dog
790	"John Fitzgerald ""Jack"" Kennedy (May 29, 1917 – November 22, 1963), often referred to by his initials JFK, was the 35th President of the United States , serving from 1961 until his death in 1963."	John F. Kennedy
791	Often referred to as Popeyes and sometimes as Popeyes Chicken & Biscuits or Popeyes Chicken & Seafood, It was acquired by Sandy Springs, Georgia -based AFC Enterprises , originally America's Favorite Chicken Company, in 1993.	Popeyes Louisiana Kitchen
792	Wendy Williams Hunter (born Wendy Joan Williams; July 18, 1964) is an American media personality , actress and author.	Wendy Williams
793	"Patrick Henry ""Treason"" speech before the House of Burgesses in an 1851 painting by Peter F. Rothermel"	Give me Liberty, or give me Death!
794	Give me liberty, or give me death! is a quotation attributed to Patrick Henry from a speech he made to the Virginia Convention .	Give me Liberty, or give me Death!
795	Roosevelt, Jr. ( ; October 27, 1858—January 6, 1919) was the 26th President of the United States (1901–1909).	Theodore Roosevelt
796	The show stars Emmanuel Lewis in the title role as a young boy who, after losing his parents, is adopted by his NFL -pro godfather, portrayed by Alex Karras , and his new socialite wife, played by Susan Clark .	Webster (TV series)
797	Four of the nation's five most popular team sports were developed in North America: American football , baseball , basketball and ice hockey , whereas soccer was developed in England.	Sports in the United States
798	The four Major leagues in the United States are the National Basketball Association (NBA), National Football League (NFL), Major League Baseball (MLB), the National Hockey League (NHL); all enjoy massive media exposure and are considered the preeminent competitions in their respective sports in the world.	Sports in the United States
799	A monarchy is a form of government in which sovereignty is actually or nominally embodied in a single individual (the monarch ).	Monarchy
800	"A newton metre is a unit of torque (also called "" moment "") in the SI system."	Newton metre
801	Acute disseminated encephalomyelitis (ADEM) is an immune mediated disease of the brain .	Acute disseminated encephalomyelitis
802	It usually occurs following a viral infection but may appear following vaccination , bacterial or parasitic infection, or even appear spontaneously.	Acute disseminated encephalomyelitis
803	John Adams (October 30, 1735 ( O.S. October 19, 1735) – July 4, 1826) was the second president of the United States (1797–1801), having earlier served as the first vice president of the United States .	John Adams
804	"Bing (known previously as Live Search, Windows Live Search, and MSN Search) is a web search engine (advertised as a "" decision engine "") from Microsoft ."	Bing
805	The HST was built by the United States space agency NASA , with contributions from the European Space Agency , and is operated by the Space Telescope Science Institute .	Hubble Space Telescope
806	Anti-inflammatory refers to the property of a substance or treatment that reduces inflammation .	Anti-inflammatory
807	Mama Told Me (Not to Come) is a song by Randy Newman written for Eric Burdon 's first solo album in 1966.	Mama Told Me Not to Come
808	Pronounced was an ocean liner for the Italian Line (Società di navigazione Italia) home ported in Genoa , Italy, most famous for its sinking in 1956, when 52 people died (51 from immediate impact).	SS Andrea Doria
809	Dialysis tubing is a type of semi- or partially permeable membrane tubing made from regenerated cellulose or cellophane .	Dialysis tubing
810	The Statue of Liberty (Liberty Enlightening the World; French: La Liberté éclairant le monde) is a neoclassical sculpture on Liberty Island in New York Harbor , designed by Frédéric Bartholdi and dedicated on October 28, 1886.	Statue of Liberty
811	AM-2201 (1-(5-fluoropentyl)-3-(1-naphthoyl)indole) is a research chemical that acts as a potent but nonselective full agonist for the cannabinoid receptor .	AM-2201
812	"Paul the Apostle and ""Timothy our brother"" wrote this epistle to ""the church of God which is at Corinth , with all the saints which are in all Achaia ""."	Second Epistle to the Corinthians
813	Heroin (diacetylmorphine or morphine diacetate ( INN )), also known as diamorphine ( BAN ), and colloquially as H, smack, horse, brown, black, tar, and other names, is an opioid analgesic synthesized by C.R. Alder Wright in 1874 by adding two acetyl groups to the molecule morphine , found in the opium poppy .	Heroin
814	George Washington ( – , 1799) was the first President of the United States (1789–1797), the commander-in-chief of the Continental Army during the American Revolutionary War , and one of the Founding Fathers of the United States .	George Washington
815	He retired from the presidency in 1797 and returned to his home, Mount Vernon , and his domestic life where he managed a variety of enterprises.	George Washington
816	A wiki ( ) is a website which allows its users to add, modify, or delete its content via a web browser usually using a simplified markup language or a rich-text editor .	Wiki
817	The Four Thirds system is a standard created by Olympus and Kodak for digital single-lens reflex camera (DSLR) design and development.<ref name='DPReview.com 2001-02-13'>	Four Thirds system
818	After Harris' death, Michael Gambon portrayed Dumbledore for all of the remaining films.	Albus Dumbledore
819	A savanna, or savannah, is a grassland ecosystem characterized by the trees being sufficiently widely spaced so that the canopy does not close.	Savanna
820	Nature Boy is a song by Eden Ahbez , published in 1947.	Nature Boy
821	Stefka Kostadinova ( Bulgaria ) has held the women's world record at since 1987, also the longest-held record in the event.	High jump
822	The launch of the PlayStation 3 into the Japanese market on 10 November 2006 marked the second major seventh generation entertainment system to be released.	PlayStation 3 launch
823	Black pepper (Piper nigrum) is a flowering vine in the family Piperaceae , cultivated for its fruit , which is usually dried and used as a spice and seasoning .	Black pepper
824	Black pepper is native to south India , and is extensively cultivated there and elsewhere in tropical regions.	Black pepper
825	Currently Vietnam is the world's largest producer and exporter of pepper, producing 34% of the world's Piper nigrum crop as of 2008.	Black pepper
826	Stingrays are common in coastal tropical and subtropical marine waters throughout the world, and also includes species found in warmer temperate oceans, such as Dasyatis thetidis , and those found in the deep ocean , such as Plesiobatis daviesi .	Stingray
827	Cocaine is a song written and recorded by JJ Cale in 1976, but also known as a cover version recorded by Eric Clapton .	Cocaine (song)
828	The attack on Pearl Harbor (called Hawaii Operation or Operation AI by the Japanese Imperial General Headquarters (Operation Z in planning) and the Battle of Pearl Harbor) was a surprise military strike conducted by the Imperial Japanese Navy against the United States naval base at Pearl Harbor , Hawaii, on the morning of December 7, 1941 (December 8 in Japan).	Attack on Pearl Harbor
829	The continent's various populations and individuals are mostly adherents of Christianity or Islam .	Religion in Africa
830	The winning designer, Chloe Dao , received $100,000 in seed money to help launch her own line, a 2007 Saturn Sky roadster, a spread in ELLE magazine, and a mentorship with the Banana Republic Design Team.	Project Runway (season 2)
831	The Miami Marlins began play in the 1993 season as the Florida Marlins.	Miami Marlins
832	In numismatics , a mule is a coin or medal minted with obverse and reverse designs not normally seen on the same piece.	Mule (coin)
833	The Dungeness crab, Metacarcinus magister (formerly Cancer magister), is a species of crab that inhabits eelgrass beds and water bottoms on the west coast of North America .	Dungeness crab
834	Mary Poppins is a 1964 musical film starring Julie Andrews , Dick Van Dyke , David Tomlinson , and Glynis Johns , produced by Walt Disney , and based on the Mary Poppins books series by P. L. Travers .	Mary Poppins (film)
835	A story arc is an extended or continuing storyline in episodic storytelling media such as television , comic books , comic strips , boardgames , video games , and in some cases, films .	Story arc
836	The Bible has been translated into many languages from the biblical languages of Hebrew , Aramaic and Greek .	Bible translations
837	The full Bible has been translated into 518 languages, and 2798 languages have at least some portion of the Bible.	Bible translations
838	Black Friday is the day following Thanksgiving Day in the United States , often regarded as the beginning of the Christmas shopping season.	Black Friday (shopping)
839	This was taken to a new extreme in 2011, when several retailers (including Target , Kohl's , Macy's , Best Buy , and Bealls ) opened at midnight for the first time.	Black Friday (shopping)
840	In 2012, Walmart and several other retailers announced that they would open most of their stores at 8:00 p.m. on Thanksgiving Day (except in states where opening on Thanksgiving is prohibited due to blue laws , such as Massachusetts where they still opened around midnight), prompting calls for a walkout among some workers.	Black Friday (shopping)
841	It was first recorded by Louis Armstrong and released as a single in 1967.	What a Wonderful World
842	"The day a presidential inauguration occurs is known as ""Inauguration Day"" and occurs on January 20 (or 21st if the 20th is a Sunday)."	United States presidential inauguration
843	Justinian I () (, ) (c. 482 – 14 November 565), commonly known as Justinian the Great, was Byzantine Emperor from 527 to 565.	Justinian I
844	Elizabeth Cady Stanton (November 12, 1815 – October 26, 1902) was an American social activist , abolitionist, and leading figure of the early women's rights movement .	Elizabeth Cady Stanton
845	Her Declaration of Sentiments , presented at the first women's rights convention held in 1848 in Seneca Falls , New York , is often credited with initiating the first organized women's rights and women's suffrage movements in the United States.	Elizabeth Cady Stanton
846	The Boston Bruins Radio Network is a 25-station (17 A.M., 8 F.M. plus 2 F.M. translators) CBS Radio network which carries live game broadcasts of the Boston Bruins .	Boston Bruins Radio Network
847	The network's flagship station is WBZ-FM /98.5- Boston, Massachusetts .	Boston Bruins Radio Network
848	"DRGs have been used in the US since 1982 to determine how much Medicare pays the hospital for each ""product"", since patients within each category are clinically similar and are expected to use the same level of hospital resources."	Diagnosis-related group
849	Ethnicity or ethnic group is a socially defined category based on common culture or nationality .	Ethnic group
850	Ethnicity can, but does not have to, include common ancestry , appearance , cuisine , dressing style, heritage , history , language or dialect , religion , symbols , traditions , or other cultural factor.	Ethnic group
851	Ethnic identity is constantly reinforced through common characteristics which set the group apart from other groups.	Ethnic group
852	The Appalachian National Scenic Trail, generally known as the Appalachian Trail or simply the A.T., is a marked hiking trail in the eastern United States extending between Springer Mountain in Georgia and Mount Katahdin in Maine .	Appalachian Trail
853	Plug-in (computing) , a piece of software which enhances another software application and usually cannot be run independently	Add-on
854	Browser extension , which modifies the interface and/or behavior of web browsers	Add-on
855	Add-on (Mozilla) , a piece of software that enhances and customizes Mozilla-based applications	Add-on
856	Add-ons for Firefox (addons.mozilla.org), the official Mozilla Foundation web site which serves as a repository of add-ons for Mozilla-based applications	Add-on
857	Peripheral , an optional computer hardware component that significantly supplements or enhances the functionality of the original unit	Add-on
