id	text	title
1	As such, African immigrants are to be distinguished from African American people, the latter of whom are descendants of mostly West and Central Africans who were involuntarily brought to the United States by means of the historic Atlantic slave trade .	African immigration to the United States
2	A glacier cave is a cave formed within the ice of a glacier .	Glacier cave
3	Pumps operate by some mechanism (typically reciprocating or rotary ), and consume energy to perform mechanical work by moving the fluid.	Pump
4	Employing over 6,000, BMC is often credited with pioneering the BSM concept as a way to help better align IT operations with business needs.	BMC Software
5	For 2011, the company recorded an annual revenue of $2.1 billion, making it the #20 largest software company in terms of revenue for that year.	BMC Software
6	This tablespoon has a capacity of about 15 mL.	Tablespoon
7	In the USA one tablespoon (measurement unit) is approximately 15 mL; the capacity of an actual tablespoon (dining utensil) ranges from 7 mL to 14 mL.	Tablespoon
8	In Australia one tablespoon (measurement unit) is 20 mL.	Tablespoon
9	The series also originated much tie-in merchandise, making the Harry Potter brand worth in excess of $15 billion.	Harry Potter
10	"A rocket engine, or simply ""rocket"", is a jet engine that uses only stored propellant mass for forming its high speed propulsive jet ."	Rocket engine
11	The actress who played Lolita, Sue Lyon , was fourteen at the time of filming.	Lolita (1962 film)
12	Transmission occurs primarily by drinking water or eating food that has been contaminated by the feces (waste product) of an infected person, including one with no apparent symptoms.	Cholera
13	Anne Frank and her sister, Margot , were eventually transferred to the Bergen-Belsen concentration camp , where they died of typhus in March 1945.	Anne Frank
14	The radial engine is a reciprocating type internal combustion engine configuration in which the cylinders point outward from a central crankshaft like the spokes of a wheel.	Radial engine
15	Deepwater drilling is the process of oil and gas exploration and production in depths of more than 500 feet.	Deepwater drilling
16	"Monica Samille Lewinsky (born July 23, 1973) is an American woman with whom United States President Bill Clinton admitted to having had an ""improper relationship"" while she worked at the White House in 1995 and 1996."	Monica Lewinsky
17	Beginning his musical career in the swing era with Harry James and Tommy Dorsey , Sinatra found unprecedented success as a solo artist from the early to mid-1940s after being signed to Columbia Records in 1943.	Frank Sinatra
18	An antibody (Ab), also known as an immunoglobulin (Ig), is a large Y-shaped protein produced by B-cells that is used by the immune system to identify and neutralize foreign objects such as bacteria and viruses .	antibody
19	The antibody recognizes a unique part of the foreign target, called an antigen .	antibody
20	"Each tip of the ""Y"" of an antibody contains a paratope (a structure analogous to a lock) that is specific for one particular epitope (similarly analogous to a key) on an antigen, allowing these two structures to bind together with precision."	antibody
21	Using this binding mechanism, an antibody can tag a microbe or an infected cell for attack by other parts of the immune system, or can neutralize its target directly (for example, by blocking a part of a microbe that is essential for its invasion and survival).	antibody
22	The 2008 Sunday Times Rich List estimated Rowling's fortune at £560 million ($798 million), ranking her as the twelfth richest woman in the United Kingdom.	J. K. Rowling
23	According to the U.S Census estimates of 2005, the city had a population of 12,381.	Auburndale, Florida
24	Kirk Douglas (born Issur Danielovitch, ; December 9, 1916) is an American stage and film actor, film producer and author.	Kirk Douglas
25	"Robert Clark ""Bob"" Seger (born May 6, 1945) is an American rock and roll singer-songwriter , guitarist and pianist ."	Bob Seger
26	The black-and-white series originally ran from October 15, 1951, to May 6, 1957, on the Columbia Broadcasting System (CBS).	I Love Lucy
27	Richard Milhous Nixon (January 9, 1913 – April 22, 1994) was the 37th President of the United States , serving from 1969 to 1974, when he became the only president to resign the office.	Richard Nixon
28	"The peso is subdivided into 100 centavos, represented by "" ¢ ""."	Mexican peso
29	James appeared in World Wrestling Entertainment (WWE) in October 2005 and was placed in a storyline with Trish Stratus , in which James' gimmick was that of Stratus' biggest fan turned obsessed stalker, an angle which lasted almost a year.	Mickie James
30	Armando Pérez (born January 15, 1981), better known by his stage name Pitbull, is an American rapper, songwriter, and record producer.	Pitbull (entertainer)
31	The original World Trade Center featured landmark twin towers, which opened on April 4, 1973 and were destroyed in the September 11 attacks of 2001, along with 7 World Trade Center.	World Trade Center
32	Each shell can contain only a fixed number of electrons: The 1st shell can hold up to two electrons, the 2nd shell can hold up to eight electrons, the 3rd shell can hold up to 18, and 4th shell can hold up to 32 and so on.	Electron shell
33	There have been 43 people sworn into office, and 44 presidencies, as Grover Cleveland served two non-consecutive terms and is counted chronologically as both the 22nd and 24th president.	List of Presidents of the United States
34	"Beatrice ""Bea"" Arthur (May 13, 1922 – April 25, 2009) was an American actress, comedienne, and singer whose career spanned seven decades."	Bea Arthur
35	State schools (also known as public schools or government schools) generally refer to primary or secondary schools mandated for or offered to all children without charge paid for, in whole or in part, by taxation .	state school
36	The term may also refer to institutions of post-secondary education funded, in whole or in part, and overseen by government.	state school
37	The light-independent reactions of photosynthesis are chemical reactions that convert carbon dioxide and other compounds into glucose .	Light-independent reactions
38	These reactions take the light-dependent reactions and perform further chemical processes on them.	Light-independent reactions
39	Interlibrary loan (abbreviated ILL, and sometimes called interloan, document delivery, or document supply) is a service whereby a user of one library can borrow books or receive photocopies of documents that are owned by another library.	Interlibrary loan
40	The user makes a request with their local library, which, acting as an intermediary, identifies owners of the desired item, places the request, receives the item, makes it available to the user, and arranges for its return.	Interlibrary loan
41	"Mariel Margaret ""Mia"" Hamm (born March 17, 1972) is a retired American professional soccer player."	Mia Hamm
42	MacConkey agar is a culture medium designed to grow Gram-negative bacteria and differentiate them for lactose fermentation .	MacConkey agar
43	This is the predominant form of Buddhism practiced in China, South Korea, Japan, Taiwan, Singapore, and Vietnam.	Buddhism by country
44	He was shot and killed while playing poker in the Nuttal & Mann's Saloon in Deadwood , Dakota Territory (now South Dakota ).	Wild Bill Hickok
45	There have been four successful robotically operated Mars rovers.	Mars rover
46	The audit opinion is intended to provide reasonable assurance, but not absolute assurance, that the financial statements are presented fairly, in all material respects, and/or give a true and fair view in accordance with the financial reporting framework.	Financial audit
47	The purpose of an audit is provide and objective independent examination of the financial statements, which increases the value and credibility of the financial statements produced by management, thus increase user confidence in the financial statement, reduce investor risk and consequently reduce the cost of capital of the preparer of the financial statements.	Financial audit
48	Financial audits are typically performed by firms of practicing accountants who are experts in financial reporting.	Financial audit
49	Owls are a group of birds that belong to the order Strigiformes, constituting 200 extant bird of prey species .	Owl
50	With quick hands and exceptional upper-body strength, Killebrew was known not just for the frequency of his home runs but also for their distance.	Harmon Killebrew
51	His main role was to interpret the will of the gods by studying the flight of birds : whether they are flying in groups or alone, what noises they make as they fly, direction of flight and what kind of birds they are.	Augur
52	The movie was extremely profitable, earning $161.5 million in North America alone.	The Waterboy
53	It is the second largest city in Oakland County in the U.S. state of Michigan .	Farmington Hills, Michigan
54	According to folklore, if it is cloudy when a groundhog emerges from its burrow on this day, then spring will come early; if it is sunny, the groundhog will supposedly see its shadow and retreat back into its burrow, and the winter weather will continue for six more weeks.	Groundhog Day
55	A Joint Committee is a term in politics that is used to refer to a committee made up of members of both chambers of a bicameral legislature.	Joint committee
56	The 50 stars on the flag represent the 50 states of the United States of America and the 13 stripes represent the thirteen British colonies that declared independence from the Kingdom of Great Britain and became the first states in the Union.	Flag of the United States
57	India is a federal union of states comprising twenty-eight states and seven union territories .	States and territories of India
58	"Symptoms are initially mild, and then develop into severe coughing fits, which produce the namesake high-pitched ""whoop"" sound in infected babies and children when they inhale air after coughing."	Pertussis
59	The coughing stage lasts approximately six weeks before subsiding.	Pertussis
60	Galveston County is a county located in the U.S. state of Texas within the Houston–Sugar Land–Baytown metropolitan area.	Galveston County, Texas
61	Nassau	List of cities in the Bahamas
62	Freeport, Bahamas	List of cities in the Bahamas
63	Its twelve member institutions (which are primarily flagship research universities in their respective states, well-regarded academically, and with relatively large student enrollment) are located primarily in the Midwest , stretching from Nebraska in the west to Penn State in the east.	Big Ten Conference
64	Single Malt Scotch is single malt whisky made in Scotland using a pot still distillation process at a single distillery , with malted barley as the only grain ingredient.	Single malt Scotch
65	As with any Scotch whisky , a single malt Scotch must be distilled in Scotland and matured in oak casks in Scotland for at least three years (most single malts are matured longer).	Single malt Scotch
66	Composers and works include Barbara Kolb , Pauline Oliveros ' Sound Patterns for chorus (1961), Norma Beecroft 's From Dreams of Brass for chorus (1963–1964), and Nancy Van de Vate .	Sound mass
67	A very early example is the opening of Jean-Féry Rebel 's ballet Les Elémens (1737–38), where chaos is represented by a gradually cumulating orchestral cluster of all seven notes of the D minor scale (Henck 2004, pp. 52–54).	Sound mass
68	A later example is the third movement of Ruth Crawford Seeger 's String Quartet 1931 (Nonesuch H-71280) while more recently Phill Niblock 's multiple drone based music serves as an example.	Sound mass
69	"The use of ""chords approaching timbres"" begins with Debussy and Edgard Varèse often carefully scored individual instrumental parts so that they would fuse into one ensemble timbre or sound mass (Erickson 1975, pp. 18 and 21)."	Sound mass
70	"Other examples include European ""textural"" compositions of the fifties and sixties such as Krzysztof Penderecki 's Threnody to the Victims of Hiroshima (1959) and György Ligeti 's works featuring micropolyphony in works like Atmosphères (1961) and his Requiem (1963-65)."	Sound mass
71	Other composers with works using this technique include Henryk Górecki , Karel Husa , Witold Lutosławski , Kazimierz Serocki , and Steven Stucky .	Sound mass
72	Sound mass techniques also appear in the music of George Crumb (Anon. n.d.).	Sound mass
73	The object is to take at least the number of tricks that were bid before play of the hand began.	Spades
74	Australia is a continent comprising mainland Australia , Tasmania , New Guinea , Seram , possibly Timor , and neighbouring islands.	Australia (continent)
75	The causes of cardiovascular disease are diverse but atherosclerosis and/or hypertension are the most common.	Cardiovascular disease
76	The history of immigration to the United States is a continuing story of peoples from more populated continents, particularly Europe and also Africa and Asia, crossing oceans to the new land.	History of immigration to the United States
77	Starting around 1600 British and other Europeans settled primarily on the east coast .	History of immigration to the United States
78	Atlanta (, stressed , locally ) is the capital of and the most populous city in the U.S. state of Georgia , with an estimated 2011 population of 432,427.	Atlanta
79	Atlanta is the cultural and economic center of the Atlanta metropolitan area , home to 5,457,831 people and the ninth largest metropolitan area in the United States.	Atlanta
80	Commonwealth is a traditional English term for a political community founded for the common good.	Commonwealth
81	Once appointed, justices have life tenure unless they resign, retire, or are removed after impeachment .	Supreme Court of the United States
82	Conroe is the seat of Montgomery County and falls within the metropolitan area.	Conroe, Texas
83	As a database, it is a software product whose primary function is to store and retrieve data as requested by other software applications, be it those on the same computer or those running on another computer across a network (including the Internet).	Microsoft SQL Server
84	The Oklahoma blast claimed 168 lives, including 19 children under the age of 6, and injured more than 680 people.	Oklahoma City bombing
85	Winning, or even being nominated for, an ARIA award results in a lot of media attention on an artist, and usually increases recording sales several-fold – in 2005 , for example, after Ben Lee won three awards, his album Awake Is the New Sleep jumped from No. 31 to No. 5 in the ARIA Charts , its highest position.	ARIA Music Awards
86	Dredging is an excavation activity or operation usually carried out at least partly underwater, in shallow seas or fresh water areas with the purpose of gathering up bottom sediments and disposing of them at a different location.	Dredging
87	A dredger (or “dredge” as is the general usage in the Americas) is any device, machine, or vessel that is used to excavate and remove material from the bottom of a body of water.	Dredging
88	For example, a scoop attached to the end of a rope or pole by which a man can draw sediments up from the bottom of a pond is a dredger.	Dredging
89	Developing this idea further, a motorized crane equipped with a drag bucket or clamshell (grabber) that is used to scoop material from the bottom of a body of water is also a dredger.	Dredging
90	If the crane is mounted on a barge, the entire vessel is referred to as a dredger.	Dredging
91	He returned to London to settle permanently in 1791, where he died ten years later.	Benedict arnold
92	He helped lead the Philadelphia Phillies to the World Series in and won World Series championships in with the Arizona Diamondbacks and in and with the Boston Red Sox .	Curt Schilling
93	Of the thousands of enumerated ports, about 250 well-known ports are reserved by convention to identify specific service types on a host.	Port (computer networking)
94	Area code 479 is the telephone area code serving thirteen counties in northwest Arkansas , including the cities of Fort Smith , Fayetteville , Springdale , Rogers and Bentonville : the second, third, fourth, eighth and tenth-largest cities in the state, respectively.	Area code 479
95	Area code 479 serves Benton , Carroll (split with area code 870 ), Crawford , Franklin , Johnson , Logan , Madison , Polk , Pope , Scott , Sebastian , Washington and Yell Counties in Arkansas.	Area code 479
96	Arraignment is a formal reading of a criminal charging document in the presence of the defendant to inform the defendant of the charges against him or her.	Arraignment
97	While he achieved fame during his lifetime as an author, philosopher, alchemist and astronomer , composing a scientific treatise on the astrolabe for his ten year-old son Lewis, Chaucer also maintained an active career in the civil service as a bureaucrat, courtier and diplomat.	Geoffrey Chaucer
98	Chaucer is a crucial figure in developing the legitimacy of the vernacular , Middle English , at a time when the dominant literary languages in England were French and Latin.	Geoffrey Chaucer
99	"The 12-hour clock is a time convention in which the 24 hours of the day are divided into two periods: a.m. (from the Latin ante meridiem, meaning ""before midday"") and p.m. (post meridiem, ""after midday"")."	12-hour clock
100	"A 2007 review of all studies comparing health outcomes in Canada and the US in a Canadian peer-reviewed medical journal found that ""health outcomes may be superior in patients cared for in Canada versus the United States, but differences are not consistent."""	Comparison of the health care systems in Canada and the United States
101	There are currently 952 games (multiplatform: 751; exclusive: 123; console exclusive: 78) on this list as of April 2, 2013.	List of Xbox 360 games
102	Pineapples may be cultivated from a crown cutting of the fruit, possibly flowering in 20–24 months and fruiting in the following six months.	Pineapple
103	Archaeological evidence suggests that the earliest known wine production occurred in what is now the country of Georgia around 7000 BCE, with other notable sites in Greater Iran dated 4500 BCE and Armenia 4100 BCE, respectively.	History of wine
104	In 1947, when India gained independence, the state of West Bengal was formed with 14 districts, as per partition plan of the then Bengal province of British India .	List of districts of West Bengal
105	This is a list of the 221 towns and 13 cities in the U.S. state of New Hampshire .	List of cities and towns in New Hampshire
106	"Though best known for its customer relationship management (CRM) product, Salesforce has also expanded into the ""social enterprise arena"" through acquisitions."	Salesforce.com
107	During one orbit around the Sun, the Earth rotates about its own axis 366.26 times, creating 365.26 solar days , or one sidereal year .	Earth
108	Cellular respiration is the set of the metabolic reactions and processes that take place in the cells of organisms to convert biochemical energy from nutrients into adenosine triphosphate (ATP), and then release waste products.	Cellular respiration
109	Cartridge-operated extinguishers contain the expellant gas in a separate cartridge that is punctured prior to discharge, exposing the propellant to the extinguishing agent.	Fire extinguisher
110	Righteousness (also called rectitude) is an important theological concept in Christianity , Judaism , Islam , Hinduism (dharma), and Zoroastrianism .	Righteousness
111	"It is an attribute that implies that a person's actions are justified, and can have the connotation that the person has been ""judged"" or ""reckoned"" as leading a life that is pleasing to the god/s portrayed in these belief systems."	Righteousness
112	Central America consists of seven countries: Belize , Costa Rica , El Salvador , Guatemala , Honduras , Nicaragua , and Panama .	Central america
113	A steam engine is a heat engine that performs mechanical work using steam as its working fluid .	Steam engine
114	Steam engines are external combustion engines , where the working fluid is separate from the combustion products.	Steam engine
115	Tacoma (, ) is a mid-sized urban port city and the county seat of Pierce County, Washington , United States.	Tacoma, Washington
116	As the second largest city in San Diego County , Chula Vista has quickly become a destination popular to many tourists.	Chula Vista, California
117	Sir Isaac Newton (25 December 164220 March 1727) was an English physicist and mathematician who is widely regarded as one of the most influential scientists of all time and as a key figure in the scientific revolution .	Isaac Newton
118	Newton's law of universal gravitation states that every point mass in the universe attracts every other point mass with a force that is directly proportional to the product of their masses and inversely proportional to the square of the distance between them.	Newton's law of universal gravitation
119	Dim sum () refers to a style of Cantonese food prepared as small bite-sized or individual portions of food traditionally served in small steamer baskets or on small plates.	Dim sum
120	Dim sum is also well known for the unique way it is served in some restaurants, wherein fully cooked and ready-to-serve dim sum dishes are carted around the restaurant for customers to choose their orders while seated at their tables.	Dim sum
121	"Eating dim sum at a restaurant is usually known in Cantonese as going to ""drink tea"" ( yum cha , 飲茶), as tea is typically served with dim sum."	Dim sum
122	A total of 4,486 U.S. soldiers were killed in Iraq between 2003 and 2012.	Casualties of the Iraq War
123	Jupiter is the fifth planet from the Sun and the largest planet in the Solar System .	Jupiter
124	Held in Kemper Arena in Kansas City , Missouri , the convention nominated President Gerald Ford for a full term, but only after narrowly defeating a strong challenge from former California Governor Ronald Reagan .	1976 Republican National Convention
125	It started with four teams and, through a series of expansions, contractions, and relocations, the league is now composed of 30 active franchises.	National Hockey League
126	Northville is an affluent city located in and divided by Oakland and Wayne counties in the U.S. state of Michigan .	Northville, Michigan
127	Most of the city is in Oakland County, and is surrounded by the city of Novi .	Northville, Michigan
128	He has led teams to eight division championships ( 1995 , 1996 , 1997 , 2002 , 2003 , 2004 , 2007 , 2009 ), five NFC Championship Games ( 1995 , 1996 , 1997 , 2007 , 2009 ), and two Super Bowl appearances ( Super Bowl XXXI , Super Bowl XXXII ), winning one (Super Bowl XXXI).	Brett Favre
129	In the United States, to table usually means the to lay [the topic] on the table or to move for postponement of consideration; a proposal to suspend consideration of a pending motion.	Table (parliamentary procedure)
130	The four families are the original Standard-Capacity (SDSC), the High-Capacity ( SDHC ), the eXtended-Capacity ( SDXC ), and the SDIO , which combines input/output functions with data storage.	Secure Digital
131	It eats leaves, herbs, twigs and green plants like skunk cabbage and clover and in the winter it may eat bark.	Porcupine
132	Elijah J. McCoy (May 2, 1844 – October 10, 1929) was a black Canadian-American inventor and engineer, who was notable for his 57 U.S. patents , most to do with lubrication of steam engines.	Elijah McCoy
133	, Apple has 405 stores worldwide, with global sales of billion in merchandise in 2011, and they lead the United States retail market in terms of sales per unit area .	Apple Store
134	"The term ""effective"" is used because the shielding effect of negatively charged electrons prevents higher orbital electrons from experiencing the full nuclear charge by the repelling effect of inner-layer electrons."	Effective nuclear charge
135	Jerky is lean meat that has been trimmed of fat, cut into strips, and then dried to prevent spoilage.	Jerky
136	Modern manufactured jerky is normally marinated in a seasoned spice rub or liquid, and dried, dehydrated or smoked with low heat (usually under 70 °C/160 °F).	Jerky
137	.eu is the country code top-level domain (ccTLD) for the European Union (EU).	.eu
138	Meister means master in German (as in master craftsman , or as an honorific title such as Meister Eckhart ).	Meister
139	During this event a very large number of the impact craters on the Moon would have formed, and by inference on Earth , Mercury , Venus and Mars as well.	Late Heavy Bombardment
140	On October 7, 1849, at age 40, Poe died in Baltimore; the cause of his death is unknown and has been variously attributed to alcohol, brain congestion, cholera , drugs, heart disease, rabies , suicide, tuberculosis, and other agents.	Edgar allan poe
141	Tycho Brahe (14 December 154624 October 1601), born Tyge Ottesen Brahe, was a Danish nobleman known for his accurate and comprehensive astronomical and planetary observations.	Tycho Brahe
142	Tycho was well known in his lifetime as an astronomer and alchemist .	Tycho Brahe
143	Four complete seasons aired, ending on February 8, 2010.	Heroes (TV series)
144	Labor Day is an American federal holiday observed on the first Monday in September, that celebrates the economic and social contributions of workers.	Labor day
145	Dylan Thomas Sprouse and Cole Mitchell Sprouse (born August 4, 1992) are American actors.	Dylan and Cole Sprouse
146	"Life insurance is a contract between an insured (insurance policy holder) and an insurer , where the insurer promises to pay a designated beneficiary a sum of money (the ""benefits"") upon the death of the insured person."	Life insurance
